<?xml version="1.0" encoding="UTF-8"?>
<!DOCTYPE list SYSTEM "accessList.dtd">
<list>
	<accept>
		<acceptList from="1.1.1.1" to="1.1.1.20" />
		<acceptList from="1.1.2.1" to="1.1.2.11" />
		<acceptAddress>4.4.4.4</acceptAddress>
		<acceptAddress>5.5.5.5</acceptAddress>
	</accept>
	<deny>
		<denyList from="1.1.1.3" to="1.1.1.10" />
		<denyList from="2.2.2.3" to="2.2.2.11" />
		<denyAddress>8.8.8.8</denyAddress>
		<denyAddress>8.8.8.9</denyAddress>
	</deny>
</list>